{
    "name": "Colin Barr",
    "title": "Senior Financial Advisor",
    "matured_mortgages": [
    {
        "date": "2025-01-04T10:00:00",
        "amount": 50000,
        "mortgagees": "Miller, Davis",
        "last_update": "2025-01-04T10:00:00",
        "crm_link": "https://example.com/mortgage1"
    },
    {
        "date": "2025-01-11T10:00:00",
        "amount": 1200000,
        "mortgagees": "Barr, Pusey",
        "last_update": "2025-01-11T10:00:00",
        "crm_link": "https://example.com/mortgage1"
    },
    {
        "date": "2025-02-14T10:00:00",
        "amount": 50000,
        "mortgagees": "Minogue, Anderson",
        "last_update": "2025-01-11T10:00:00",
        "crm_link": "https://example.com/mortgage1"
    },    {
        "date": "2025-02-28T10:00:00",
        "amount": 50000,
        "mortgagees": "Alford, Wilson",
        "last_update": "2025-01-11T10:00:00",
        "crm_link": "https://example.com/mortgage1"
    }
],
    "renewing_mortgages": [
        {
            "date": "2025-10-01T10:00:00",
            "amount": 50000,
            "mortgagees": "Miller, Davis",
            "last_update": "2025-10-01T10:00:00",
            "crm_link": "https://example.com/mortgage1"
        },
        {
            "date": "2025-05-15T10:00:00",
            "amount": 75000,
            "mortgagees": "Client A, Client B",
            "last_update": "2025-05-01T10:00:00",
            "crm_link": "https://example.com/mortgage2"
        },
        {
            "date": "2025-05-20T10:00:00",
            "amount": 120000,
            "mortgagees": "Client C",
            "last_update": "2025-05-01T10:00:00",
            "crm_link": "https://example.com/mortgage3"
        },
        {
            "date": "2025-05-25T10:00:00",
            "amount": 95000,
            "mortgagees": "Client D, Client E",
            "last_update": "2025-05-01T10:00:00",
            "crm_link": "https://example.com/mortgage4"
        },
        {
            "date": "2025-05-30T10:00:00",
            "amount": 60000,
            "mortgagees": "Client F",
            "last_update": "2025-05-01T10:00:00",
            "crm_link": "https://example.com/mortgage5"
        },
        {
            "date": "2025-06-10T10:00:00",
            "amount": 80000,
            "mortgagees": "Client G, Client H",
            "last_update": "2025-05-01T10:00:00",
            "crm_link": "https://example.com/mortgage6"
        },
        {
            "date": "2025-06-20T10:00:00",
            "amount": 110000,
            "mortgagees": "Client I",
            "last_update": "2025-05-01T10:00:00",
            "crm_link": "https://example.com/mortgage7"
        },
        {
            "date": "2025-06-25T10:00:00",
            "amount": 70000,
            "mortgagees": "Client J, Client K",
            "last_update": "2025-05-01T10:00:00",
            "crm_link": "https://example.com/mortgage8"
        },
        {
            "date": "2025-07-15T10:00:00",
            "amount": 90000,
            "mortgagees": "Client L",
            "last_update": "2025-05-01T10:00:00",
            "crm_link": "https://example.com/mortgage9"
        },
        {
            "date": "2025-07-20T10:00:00",
            "amount": 105000,
            "mortgagees": "Client M, Client N",
            "last_update": "2025-05-01T10:00:00",
            "crm_link": "https://example.com/mortgage10"
        },
        {
            "date": "2025-08-01T10:00:00",
            "amount": 115000,
            "mortgagees": "Client O",
            "last_update": "2025-05-01T10:00:00",
            "crm_link": "https://example.com/mortgage11"
        }
    ],
    "appointments": [
        {
            "date": "2025-10-01T10:00:00",
            "clients": "Doe, Deer",
            "crm_link": "https://example.com/appointment1",
            "coconut_link": "https://example.com/coconut1",
            "service": "Update My Account(s) or Service(s)",
            "last_update": "2025-10-01T10:00:00"
        },
        {
            "date": "2025-10-01T10:00:00",
            "clients": "Streisand",
            "crm_link": "https://example.com/appointment1",
            "coconut_link": "https://example.com/coconut1",
            "service": "Update My Account(s) or Service(s)",
            "last_update": "2025-10-01T10:00:00"
        },
        {
            "date": "2025-05-01T10:00:00",
            "clients": "Client A, Client B",
            "crm_link": "https://example.com/appointment2",
            "coconut_link": "https://example.com/coconut2",
            "service": "Consultation",
            "last_update": "2025-05-01T10:00:00"
        },
        {
            "date": "2025-05-02T11:00:00",
            "clients": "Client C",
            "crm_link": "https://example.com/appointment3",
            "coconut_link": "https://example.com/coconut3",
            "service": "Financial Planning",
            "last_update": "2025-05-02T11:00:00"
        },
        {
            "date": "2025-05-03T09:30:00",
            "clients": "Client D, Client E",
            "crm_link": "https://example.com/appointment4",
            "coconut_link": "https://example.com/coconut4",
            "service": "Mortgage Review",
            "last_update": "2025-05-03T09:30:00"
        },
        {
            "date": "2025-05-04T14:00:00",
            "clients": "Client F",
            "crm_link": "https://example.com/appointment5",
            "coconut_link": "https://example.com/coconut5",
            "service": "Investment Advice",
            "last_update": "2025-05-04T14:00:00"
        },
        {
            "date": "2025-05-05T15:00:00",
            "clients": "Client G, Client H",
            "crm_link": "https://example.com/appointment6",
            "coconut_link": "https://example.com/coconut6",
            "service": "Retirement Planning",
            "last_update": "2025-05-05T15:00:00"
        },
        {
            "date": "2025-05-06T10:30:00",
            "clients": "Client I",
            "crm_link": "https://example.com/appointment7",
            "coconut_link": "https://example.com/coconut7",
            "service": "Tax Consultation",
            "last_update": "2025-05-06T10:30:00"
        },
        {
            "date": "2025-05-07T13:00:00",
            "clients": "Client J, Client K",
            "crm_link": "https://example.com/appointment8",
            "coconut_link": "https://example.com/coconut8",
            "service": "Account Review",
            "last_update": "2025-05-07T13:00:00"
        },
        {
            "date": "2025-05-08T09:00:00",
            "clients": "Client L",
            "crm_link": "https://example.com/appointment9",
            "coconut_link": "https://example.com/coconut9",
            "service": "Portfolio Management",
            "last_update": "2025-05-08T09:00:00"
        },
        {
            "date": "2025-05-09T16:00:00",
            "clients": "Client M, Client N",
            "crm_link": "https://example.com/appointment10",
            "coconut_link": "https://example.com/coconut10",
            "service": "Insurance Review",
            "last_update": "2025-05-09T16:00:00"
        },
        {
            "date": "2025-05-10T11:30:00",
            "clients": "Client O",
            "crm_link": "https://example.com/appointment11",
            "coconut_link": "https://example.com/coconut11",
            "service": "Estate Planning",
            "last_update": "2025-05-10T11:30:00"
        },
        {
            "date": "2025-05-12T10:00:00",
            "clients": "Client P, Client Q",
            "crm_link": "https://example.com/appointment12",
            "coconut_link": "https://example.com/coconut12",
            "service": "Consultation",
            "last_update": "2025-05-12T10:00:00"
        },
        {
            "date": "2025-05-13T14:00:00",
            "clients": "Client R",
            "crm_link": "https://example.com/appointment13",
            "coconut_link": "https://example.com/coconut13",
            "service": "Financial Planning",
            "last_update": "2025-05-13T14:00:00"
        },
        {
            "date": "2025-05-14T09:30:00",
            "clients": "Client S, Client T",
            "crm_link": "https://example.com/appointment14",
            "coconut_link": "https://example.com/coconut14",
            "service": "Mortgage Review",
            "last_update": "2025-05-14T09:30:00"
        },
        {
            "date": "2025-05-15T11:00:00",
            "clients": "Client U",
            "crm_link": "https://example.com/appointment15",
            "coconut_link": "https://example.com/coconut15",
            "service": "Investment Advice",
            "last_update": "2025-05-15T11:00:00"
        },
        {
            "date": "2025-05-19T15:00:00",
            "clients": "Client V, Client W",
            "crm_link": "https://example.com/appointment16",
            "coconut_link": "https://example.com/coconut16",
            "service": "Retirement Planning",
            "last_update": "2025-05-19T15:00:00"
        },
        {
            "date": "2025-05-20T10:30:00",
            "clients": "Client X",
            "crm_link": "https://example.com/appointment17",
            "coconut_link": "https://example.com/coconut17",
            "service": "Tax Consultation",
            "last_update": "2025-05-20T10:30:00"
        }
    ]
}